{
  "$schema":"https://json-schema.org/draft/2020-12/schema","$id":"carrier.schema.json","title":"Fleet Commander M3 pull/delivery/event/ack carrier","type":"object","additionalProperties":false,
  "required":["schema","fleet_id","ship_id","connection_generation","type","fleet_to_ship_ack","ship_to_fleet_ack"],"properties":{"schema":{"const":"fleet.commander.mailbox-carrier.v1"},"fleet_id":{"$ref":"#/$defs/id"},"ship_id":{"$ref":"#/$defs/id"},"connection_generation":{"type":"integer","minimum":1,"maximum":18446744073709551615},"type":{"enum":["ship.pull.v1","fleet.delivery.v1","ship.event.v1","mailbox.ack.v1"]},"fleet_to_ship_ack":{"type":"integer","minimum":0,"maximum":18446744073709551615},"ship_to_fleet_ack":{"type":"integer","minimum":0,"maximum":18446744073709551615},"message":{"$ref":"mailbox-message.schema.json"}},
  "allOf":[{"if":{"properties":{"type":{"const":"ship.pull.v1"}},"required":["type"]},"then":{"not":{"required":["message"]}}},{"if":{"properties":{"type":{"const":"fleet.delivery.v1"}},"required":["type"]},"then":{"required":["message"],"properties":{"message":{"properties":{"direction":{"const":"fleet_to_ship"},"body":{"properties":{"type":{"const":"commander.instruction.v1"}},"required":["type"]}},"required":["direction","body"]}}}},{"if":{"properties":{"type":{"const":"ship.event.v1"}},"required":["type"]},"then":{"required":["message"],"properties":{"message":{"properties":{"direction":{"const":"ship_to_fleet"},"body":{"properties":{"type":{"enum":["captain.progress.v1","captain.completed.v1"]}},"required":["type"]}},"required":["direction","body"]}}}},{"if":{"properties":{"type":{"const":"mailbox.ack.v1"}},"required":["type"]},"then":{"not":{"required":["message"]}}}],
  "$defs":{"id":{"type":"string","pattern":"^[A-Za-z0-9][A-Za-z0-9_-]{15,95}$","maxLength":96}}
}
