{"schema":"fleet.commander.mailbox-carrier.v1","fleet_id":"flt_0123456789abcdef","ship_id":"shp_0123456789abcdef","connection_generation":1,"type":"ship.event.v1","fleet_to_ship_ack":1,"ship_to_fleet_ack":0,"message":{"schema":"fleet.commander.mailbox-message.v1","message_id":"msg_0123456789abcdef","instruction_id":"ins_0123456789abcdef","fleet_id":"flt_0123456789abcdef","ship_id":"shp_0123456789abcdef","direction":"ship_to_fleet","mailbox_sequence":1,"expires_at":"2026-07-14T19:22:42.123Z","body":{"type":"captain.progress.v1","delegation_id":"dlg_0123456789abcdef","state":"accepted"}}}
